{
  "command": "fallback",
  "status": "success",
  "exit_code": 0,
  "run_id": "550e8400-e29b-41d4-a716-446655440022",
  "started_at": "2026-01-30T16:00:00Z",
  "completed_at": "2026-01-30T16:01:00Z",
  "duration_ms": 60000,
  "tool": "dsr",
  "version": "1.0.0",
  "schema_version": "1.0.0",
  "artifacts": [],
  "warnings": [],
  "errors": [],
  "details": {
    "repo": "ntm",
    "version": "v1.2.3",
    "steps": [
      {
        "command": "check",
        "status": "success",
        "exit_code": 0,
        "run_id": "550e8400-e29b-41d4-a716-446655440023",
        "duration_ms": 1200
      },
      {
        "command": "build",
        "status": "success",
        "exit_code": 0,
        "run_id": "550e8400-e29b-41d4-a716-446655440024",
        "duration_ms": 45000
      },
      {
        "command": "release",
        "status": "success",
        "exit_code": 0,
        "run_id": "550e8400-e29b-41d4-a716-446655440025",
        "duration_ms": 8000
      }
    ],
    "build_manifest": "/tmp/dsr/manifests/ntm-v1.2.3.json",
    "release_url": "https://github.com/owner/ntm/releases/tag/v1.2.3"
  }
}
